{"$defs":{"binding":{"additionalProperties":false,"properties":{"content_hash":{"$ref":"#/$defs/sha256"},"id":{"$ref":"#/$defs/id"},"revision":{"$ref":"#/$defs/revision"}},"required":["id","revision","content_hash"],"type":"object"},"capabilities":{"items":{"$ref":"#/$defs/capability"},"maxItems":64,"type":"array","uniqueItems":true},"capability":{"enum":["project.read","artifact.read","artifact.propose","tool.invoke","memory.read","memory.propose"]},"id":{"maxLength":64,"minLength":2,"pattern":"^[a-z][a-z0-9_]{1,63}$","type":"string"},"identity":{"additionalProperties":false,"properties":{"content_hash":{"$ref":"#/$defs/sha256"},"id":{"$ref":"#/$defs/id"}},"required":["id","content_hash"],"type":"object"},"revision":{"maximum":9007199254740991,"minimum":1,"type":"integer"},"sha256":{"pattern":"^[0-9a-f]{64}$","type":"string"},"tools":{"items":{"maxLength":1024,"pattern":"^[a-z][a-z0-9_]{1,63}(?:\\.[a-z][a-z0-9_]{1,63})+$","type":"string"},"maxItems":64,"type":"array","uniqueItems":true},"work_order":{"additionalProperties":false,"properties":{"capability_ids":{"$ref":"#/$defs/capabilities"},"content_hash":{"$ref":"#/$defs/sha256"},"id":{"$ref":"#/$defs/id"},"revision":{"$ref":"#/$defs/revision"},"tool_ids":{"$ref":"#/$defs/tools"}},"required":["id","revision","content_hash","capability_ids","tool_ids"],"type":"object"}},"$id":"https://world-forge.local/schemas/agent-worker-activation.schema.json","$schema":"https://json-schema.org/draft/2020-12/schema","additionalProperties":false,"properties":{"activation_id":{"$ref":"#/$defs/id"},"content_hash":{"$ref":"#/$defs/sha256"},"context_mode":{"const":"fresh"},"execution_id":{"$ref":"#/$defs/id"},"format":{"const":"world-forge.agent_worker_activation"},"format_version":{"const":1},"input":{"$ref":"#/$defs/identity"},"prompt":{"$ref":"#/$defs/identity"},"requested_capability_ids":{"$ref":"#/$defs/capabilities"},"requested_tool_ids":{"$ref":"#/$defs/tools"},"role":{"$ref":"#/$defs/binding"},"runtime":{"$ref":"#/$defs/binding"},"work_order":{"$ref":"#/$defs/work_order"}},"required":["format","format_version","activation_id","execution_id","role","work_order","runtime","prompt","input","context_mode","requested_capability_ids","requested_tool_ids","content_hash"],"title":"Immutable Agent Worker Activation v1","type":"object","x-world-forge-agent-harness-coherent":true}
