{"activation_id":"activation_01","content_hash":"69fe43c3662aa6e984f97160d23f8217e9f7428bbc8dc5af04326c189bed79ce","context_mode":"fresh","execution_id":"execution_01","format":"world-forge.agent_worker_activation","format_version":1,"input":{"content_hash":"5555555555555555555555555555555555555555555555555555555555555555","id":"input_01"},"prompt":{"content_hash":"4444444444444444444444444444444444444444444444444444444444444444","id":"prompt_01"},"requested_capability_ids":["artifact.read","project.read","tool.invoke"],"requested_tool_ids":["source.read","world.validate"],"role":{"content_hash":"1111111111111111111111111111111111111111111111111111111111111111","id":"author","revision":1},"runtime":{"content_hash":"3333333333333333333333333333333333333333333333333333333333333333","id":"harness_runtime","revision":1},"work_order":{"capability_ids":["artifact.read","project.read","tool.invoke"],"content_hash":"2222222222222222222222222222222222222222222222222222222222222222","id":"work_order_01","revision":1,"tool_ids":["source.read","world.validate"]}}